{
  "$schema": "http://json-schema.org/draft-07/schema#",
  "type": "object",
  "required": ["id", "name", "description", "type", "endpoints", "authentication", "features", "status"],
  "properties": {
    "id": {
      "type": "string",
      "pattern": "^[a-z0-9-]+$",
      "description": "Unique identifier for the provider"
    },
    "name": {
      "type": "string",
      "description": "Display name of the provider"
    },
    "description": {
      "type": "string",
      "description": "Brief description of the provider's services"
    },
    "type": {
      "type": "array",
      "items": {
        "type": "string",
        "enum": ["openai-compatible", "standalone"]
      },
      "minItems": 1,
      "description": "Categories the provider belongs to"
    },
    "endpoints": {
      "type": "object",
      "required": ["base_url"],
      "properties": {
        "base_url": {
          "type": "string",
          "format": "uri",
          "description": "Base URL for API requests"
        },
        "completions": {
          "type": "string",
          "description": "Path for completions endpoint"
        },
        "chat": {
          "type": "string",
          "description": "Path for chat completions endpoint"
        },
        "embeddings": {
          "type": "string",
          "description": "Path for embeddings endpoint"
        }
      }
    },
    "authentication": {
      "type": "object",
      "required": ["type", "header"],
      "properties": {
        "type": {
          "type": "string",
          "enum": ["api_key", "oauth2", "basic"],
          "description": "Authentication method"
        },
        "header": {
          "type": "string",
          "description": "HTTP header used for authentication"
        }
      }
    },
    "features": {
      "type": "array",
      "items": {
        "type": "string",
        "enum": [
          "text-generation",
          "chat",
          "embeddings",
          "fine-tuning",
          "image-generation",
          "audio-transcription",
          "audio-generation"
        ]
      },
      "description": "List of supported features"
    },
    "pricing": {
      "type": "object",
      "properties": {
        "free_tier": {
          "type": "boolean",
          "description": "Whether a free tier is available"
        },
        "details_url": {
          "type": "string",
          "format": "uri",
          "description": "URL to pricing details"
        }
      }
    },
    "documentation_url": {
      "type": "string",
      "format": "uri",
      "description": "URL to provider documentation"
    },
    "status": {
      "type": "string",
      "enum": ["active", "beta", "deprecated"],
      "description": "Current status of the provider"
    }
  }
}